{
    "watershed_name": "Indian Creek",
    "domain_name": "v01",
    "year": 1995,
    "n_storms": 10,
    "declustered": true,
    "data_variables": [
        "APCP_surface",
        "TMP_2maboveground"
    ],
    "zarr_s3_path": "s3://noaa-xfer/wrds/1995",
    "geojson_s3_path": "s3://tempest/watersheds/indian-creek/indian-creek-transpo-area-v01.geojson"
}